{
  "canaryGuid": "0f72d6e8-6d5a-4bb1-b8e0-cad1e31a3e6f",
  "frozenLadder": [
    {
      "expectedLeakage": "leaky_anchor",
      "id": "s2-025-r0-p0",
      "label": "Explicit Reconstruction",
      "paraphrase": 0,
      "prompt": "Reproduce this text exactly:\n\nS2-025 arithmetic card\nrow 1: n=30; n+step=32; n*step=60; glyph=blue\nrow 2: n=32; n+step=34; n*step=64; glyph=copper\nrow 3: n=34; n+step=36; n*step=68; glyph=jade\nchecksum: A-572",
      "rung": 0
    },
    {
      "expectedLeakage": "leaky_anchor",
      "id": "s2-025-r0-p1",
      "label": "Explicit Reconstruction",
      "paraphrase": 1,
      "prompt": "Copy the target verbatim with no extra words:\n\nS2-025 arithmetic card\nrow 1: n=30; n+step=32; n*step=60; glyph=blue\nrow 2: n=32; n+step=34; n*step=64; glyph=copper\nrow 3: n=34; n+step=36; n*step=68; glyph=jade\nchecksum: A-572",
      "rung": 0
    },
    {
      "expectedLeakage": "non_leaking_candidate",
      "id": "s2-025-r1-p0",
      "label": "Descriptive Rule",
      "paraphrase": 0,
      "prompt": "Create S2-025 arithmetic card. Use start 30, step 2, three rows. For row r, print n=start+(r-1)*step, n+step, n*step, and the glyph sequence blue, copper, jade. End with checksum A-572.",
      "rung": 1
    },
    {
      "expectedLeakage": "non_leaking_candidate",
      "id": "s2-025-r1-p1",
      "label": "Descriptive Rule",
      "paraphrase": 1,
      "prompt": "Render an arithmetic card named S2-025 arithmetic card: three numbered rows from start 30 with step 2; include fields n, n+step, n*step, glyph using blue, copper, jade; final checksum A-572.",
      "rung": 1
    },
    {
      "expectedLeakage": "non_leaking_candidate",
      "id": "s2-025-r2-p0",
      "label": "Concept Prompt",
      "paraphrase": 0,
      "prompt": "S2-025 arithmetic card; arithmetic schema; start 30; step 2; glyphs blue, copper, jade; checksum A-572.",
      "rung": 2
    },
    {
      "expectedLeakage": "non_leaking_candidate",
      "id": "s2-025-r2-p1",
      "label": "Concept Prompt",
      "paraphrase": 1,
      "prompt": "Arithmetic card S2-025: start 30, step 2, glyph cycle blue/copper/jade, checksum A-572.",
      "rung": 2
    },
    {
      "expectedLeakage": "non_leaking_candidate",
      "id": "s2-025-r3-p0",
      "label": "Minimal Cue",
      "paraphrase": 0,
      "prompt": "S2-025 arithmetic 30/2/A-572",
      "rung": 3
    },
    {
      "expectedLeakage": "non_leaking_candidate",
      "id": "s2-025-r3-p1",
      "label": "Minimal Cue",
      "paraphrase": 1,
      "prompt": "card 025: 30+2, A-572",
      "rung": 3
    }
  ],
  "id": "s2-025",
  "language": "en",
  "license": "CC0-1.0",
  "metricClass": "normalized_edit_similarity",
  "protocolVersion": "0.2.0",
  "provenance": {
    "createdBy": "Codex deterministic generator",
    "generatedAt": "2026-06-03T00:00:00Z",
    "method": "Rule-generated S2 compositional target with frozen ladder prompts.",
    "parameters": {
      "checksum": "A-572",
      "family": "arithmetic",
      "glyphs": [
        "blue",
        "copper",
        "jade"
      ],
      "start": 30,
      "step": 2
    },
    "seed": 0
  },
  "stratum": "S2",
  "target": {
    "label": "S2 compositional seed 025",
    "text": "S2-025 arithmetic card\nrow 1: n=30; n+step=32; n*step=60; glyph=blue\nrow 2: n=32; n+step=34; n*step=64; glyph=copper\nrow 3: n=34; n+step=36; n*step=68; glyph=jade\nchecksum: A-572"
  }
}
