{
  "canaryGuid": "0f72d6e8-6d5a-4bb1-b8e0-cad1e31a3e6f",
  "frozenLadder": [
    {
      "expectedLeakage": "leaky_anchor",
      "id": "s2-011-r0-p0",
      "label": "Explicit Reconstruction",
      "paraphrase": 0,
      "prompt": "Reproduce this text exactly:\n\nS2-011 letter lattice\nA. Aster drifts the jade delta at 87.\nB. Beryl echoes the violet ember at 96.\nC. Cato folds the silver fable at 16.\nD. Dessa glows the crimson glyph at 25.\nchecksum: L-506",
      "rung": 0
    },
    {
      "expectedLeakage": "leaky_anchor",
      "id": "s2-011-r0-p1",
      "label": "Explicit Reconstruction",
      "paraphrase": 1,
      "prompt": "Copy the target verbatim with no extra words:\n\nS2-011 letter lattice\nA. Aster drifts the jade delta at 87.\nB. Beryl echoes the violet ember at 96.\nC. Cato folds the silver fable at 16.\nD. Dessa glows the crimson glyph at 25.\nchecksum: L-506",
      "rung": 0
    },
    {
      "expectedLeakage": "non_leaking_candidate",
      "id": "s2-011-r1-p0",
      "label": "Descriptive Rule",
      "paraphrase": 0,
      "prompt": "Create S2-011 letter lattice. Four lettered lines A-D use names Aster, Beryl, Cato, Dessa. For each line write '<letter>. <name> <verb> the <color> <noun> at <number>.' Use values Aster:jade:delta:drifts:87; Beryl:violet:ember:echoes:96; Cato:silver:fable:folds:16; Dessa:crimson:glyph:glows:25. End with checksum L-506.",
      "rung": 1
    },
    {
      "expectedLeakage": "non_leaking_candidate",
      "id": "s2-011-r1-p1",
      "label": "Descriptive Rule",
      "paraphrase": 1,
      "prompt": "Render a letter lattice titled S2-011 letter lattice: A-D lines with the fixed name/color/noun/verb/number tuples Aster:jade:delta:drifts:87; Beryl:violet:ember:echoes:96; Cato:silver:fable:folds:16; Dessa:crimson:glyph:glows:25 and final checksum L-506.",
      "rung": 1
    },
    {
      "expectedLeakage": "non_leaking_candidate",
      "id": "s2-011-r2-p0",
      "label": "Concept Prompt",
      "paraphrase": 0,
      "prompt": "S2-011 letter lattice; A-D lattice; tuples Aster:jade:delta:drifts:87 | Beryl:violet:ember:echoes:96 | Cato:silver:fable:folds:16 | Dessa:crimson:glyph:glows:25; checksum L-506.",
      "rung": 2
    },
    {
      "expectedLeakage": "non_leaking_candidate",
      "id": "s2-011-r2-p1",
      "label": "Concept Prompt",
      "paraphrase": 1,
      "prompt": "Lattice S2-011: Aster/Beryl/Cato/Dessa tuple list Aster:jade:delta:drifts:87 | Beryl:violet:ember:echoes:96 | Cato:silver:fable:folds:16 | Dessa:crimson:glyph:glows:25; L-506.",
      "rung": 2
    },
    {
      "expectedLeakage": "non_leaking_candidate",
      "id": "s2-011-r3-p0",
      "label": "Minimal Cue",
      "paraphrase": 0,
      "prompt": "S2-011 lattice L-506",
      "rung": 3
    },
    {
      "expectedLeakage": "non_leaking_candidate",
      "id": "s2-011-r3-p1",
      "label": "Minimal Cue",
      "paraphrase": 1,
      "prompt": "lattice 011: Aster:jade:delta:drifts:87 ... L-506",
      "rung": 3
    }
  ],
  "id": "s2-011",
  "language": "en",
  "license": "CC0-1.0",
  "metricClass": "normalized_edit_similarity",
  "protocolVersion": "0.2.0",
  "provenance": {
    "createdBy": "Codex deterministic generator",
    "generatedAt": "2026-06-03T00:00:00Z",
    "method": "Rule-generated S2 compositional target with frozen ladder prompts.",
    "parameters": {
      "checksum": "L-506",
      "family": "letter-lattice",
      "values": [
        "Aster:jade:delta:drifts:87",
        "Beryl:violet:ember:echoes:96",
        "Cato:silver:fable:folds:16",
        "Dessa:crimson:glyph:glows:25"
      ]
    },
    "seed": 0
  },
  "stratum": "S2",
  "target": {
    "label": "S2 compositional seed 011",
    "text": "S2-011 letter lattice\nA. Aster drifts the jade delta at 87.\nB. Beryl echoes the violet ember at 96.\nC. Cato folds the silver fable at 16.\nD. Dessa glows the crimson glyph at 25.\nchecksum: L-506"
  }
}
