{
  "canaryGuid": "0f72d6e8-6d5a-4bb1-b8e0-cad1e31a3e6f",
  "frozenLadder": [
    {
      "expectedLeakage": "leaky_anchor",
      "id": "s2-003-r0-p0",
      "label": "Explicit Reconstruction",
      "paraphrase": 0,
      "prompt": "Reproduce this text exactly:\n\nS2-003 route receipt\nleg 1: go west for 14; mark=Q5\nleg 2: go north for 7; mark=T8\nleg 3: go east for 13; mark=N4\nleg 4: go south for 6; mark=V6\ntotal: 40; parity: even; code: R-775",
      "rung": 0
    },
    {
      "expectedLeakage": "leaky_anchor",
      "id": "s2-003-r0-p1",
      "label": "Explicit Reconstruction",
      "paraphrase": 1,
      "prompt": "Copy the target verbatim with no extra words:\n\nS2-003 route receipt\nleg 1: go west for 14; mark=Q5\nleg 2: go north for 7; mark=T8\nleg 3: go east for 13; mark=N4\nleg 4: go south for 6; mark=V6\ntotal: 40; parity: even; code: R-775",
      "rung": 0
    },
    {
      "expectedLeakage": "non_leaking_candidate",
      "id": "s2-003-r1-p0",
      "label": "Descriptive Rule",
      "paraphrase": 0,
      "prompt": "Create S2-003 route receipt. Print four legs as 'leg i: go direction for distance; mark=mark'. Use leg triples west:14:Q5; north:7:T8; east:13:N4; south:6:V6. Then print total 40, parity even, code R-775.",
      "rung": 1
    },
    {
      "expectedLeakage": "non_leaking_candidate",
      "id": "s2-003-r1-p1",
      "label": "Descriptive Rule",
      "paraphrase": 1,
      "prompt": "Render a route receipt named S2-003 route receipt; four legs from triples west:14:Q5; north:7:T8; east:13:N4; south:6:V6; finish with total 40, parity even, and code R-775.",
      "rung": 1
    },
    {
      "expectedLeakage": "non_leaking_candidate",
      "id": "s2-003-r2-p0",
      "label": "Concept Prompt",
      "paraphrase": 0,
      "prompt": "S2-003 route receipt; route schema; legs west:14:Q5 | north:7:T8 | east:13:N4 | south:6:V6; total 40; even; R-775.",
      "rung": 2
    },
    {
      "expectedLeakage": "non_leaking_candidate",
      "id": "s2-003-r2-p1",
      "label": "Concept Prompt",
      "paraphrase": 1,
      "prompt": "Route S2-003: west:14:Q5 | north:7:T8 | east:13:N4 | south:6:V6 -> 40/even/R-775.",
      "rung": 2
    },
    {
      "expectedLeakage": "non_leaking_candidate",
      "id": "s2-003-r3-p0",
      "label": "Minimal Cue",
      "paraphrase": 0,
      "prompt": "S2-003 route R-775",
      "rung": 3
    },
    {
      "expectedLeakage": "non_leaking_candidate",
      "id": "s2-003-r3-p1",
      "label": "Minimal Cue",
      "paraphrase": 1,
      "prompt": "route 003: west:14:Q5 ... R-775",
      "rung": 3
    }
  ],
  "id": "s2-003",
  "language": "en",
  "license": "CC0-1.0",
  "metricClass": "normalized_edit_similarity",
  "protocolVersion": "0.2.0",
  "provenance": {
    "createdBy": "Codex deterministic generator",
    "generatedAt": "2026-06-03T00:00:00Z",
    "method": "Rule-generated S2 compositional target with frozen ladder prompts.",
    "parameters": {
      "code": "R-775",
      "family": "route",
      "legs": [
        "west:14:Q5",
        "north:7:T8",
        "east:13:N4",
        "south:6:V6"
      ],
      "parity": "even",
      "total": 40
    },
    "seed": 0
  },
  "stratum": "S2",
  "target": {
    "label": "S2 compositional seed 003",
    "text": "S2-003 route receipt\nleg 1: go west for 14; mark=Q5\nleg 2: go north for 7; mark=T8\nleg 3: go east for 13; mark=N4\nleg 4: go south for 6; mark=V6\ntotal: 40; parity: even; code: R-775"
  }
}
