{
  "canaryGuid": "0f72d6e8-6d5a-4bb1-b8e0-cad1e31a3e6f",
  "frozenLadder": [
    {
      "expectedLeakage": "leaky_anchor",
      "id": "s2-020-r0-p0",
      "label": "Explicit Reconstruction",
      "paraphrase": 0,
      "prompt": "Reproduce this text exactly:\n\nS2-020 letter lattice\nA. Aster echoes the violet ember at 61.\nB. Beryl folds the silver fable at 70.\nC. Cato glows the crimson glyph at 79.\nD. Dessa halts the olive harbor at 88.\nchecksum: L-904",
      "rung": 0
    },
    {
      "expectedLeakage": "leaky_anchor",
      "id": "s2-020-r0-p1",
      "label": "Explicit Reconstruction",
      "paraphrase": 1,
      "prompt": "Copy the target verbatim with no extra words:\n\nS2-020 letter lattice\nA. Aster echoes the violet ember at 61.\nB. Beryl folds the silver fable at 70.\nC. Cato glows the crimson glyph at 79.\nD. Dessa halts the olive harbor at 88.\nchecksum: L-904",
      "rung": 0
    },
    {
      "expectedLeakage": "non_leaking_candidate",
      "id": "s2-020-r1-p0",
      "label": "Descriptive Rule",
      "paraphrase": 0,
      "prompt": "Create S2-020 letter lattice. Four lettered lines A-D use names Aster, Beryl, Cato, Dessa. For each line write '<letter>. <name> <verb> the <color> <noun> at <number>.' Use values Aster:violet:ember:echoes:61; Beryl:silver:fable:folds:70; Cato:crimson:glyph:glows:79; Dessa:olive:harbor:halts:88. End with checksum L-904.",
      "rung": 1
    },
    {
      "expectedLeakage": "non_leaking_candidate",
      "id": "s2-020-r1-p1",
      "label": "Descriptive Rule",
      "paraphrase": 1,
      "prompt": "Render a letter lattice titled S2-020 letter lattice: A-D lines with the fixed name/color/noun/verb/number tuples Aster:violet:ember:echoes:61; Beryl:silver:fable:folds:70; Cato:crimson:glyph:glows:79; Dessa:olive:harbor:halts:88 and final checksum L-904.",
      "rung": 1
    },
    {
      "expectedLeakage": "non_leaking_candidate",
      "id": "s2-020-r2-p0",
      "label": "Concept Prompt",
      "paraphrase": 0,
      "prompt": "S2-020 letter lattice; A-D lattice; tuples Aster:violet:ember:echoes:61 | Beryl:silver:fable:folds:70 | Cato:crimson:glyph:glows:79 | Dessa:olive:harbor:halts:88; checksum L-904.",
      "rung": 2
    },
    {
      "expectedLeakage": "non_leaking_candidate",
      "id": "s2-020-r2-p1",
      "label": "Concept Prompt",
      "paraphrase": 1,
      "prompt": "Lattice S2-020: Aster/Beryl/Cato/Dessa tuple list Aster:violet:ember:echoes:61 | Beryl:silver:fable:folds:70 | Cato:crimson:glyph:glows:79 | Dessa:olive:harbor:halts:88; L-904.",
      "rung": 2
    },
    {
      "expectedLeakage": "non_leaking_candidate",
      "id": "s2-020-r3-p0",
      "label": "Minimal Cue",
      "paraphrase": 0,
      "prompt": "S2-020 lattice L-904",
      "rung": 3
    },
    {
      "expectedLeakage": "non_leaking_candidate",
      "id": "s2-020-r3-p1",
      "label": "Minimal Cue",
      "paraphrase": 1,
      "prompt": "lattice 020: Aster:violet:ember:echoes:61 ... L-904",
      "rung": 3
    }
  ],
  "id": "s2-020",
  "language": "en",
  "license": "CC0-1.0",
  "metricClass": "normalized_edit_similarity",
  "protocolVersion": "0.2.0",
  "provenance": {
    "createdBy": "Codex deterministic generator",
    "generatedAt": "2026-06-03T00:00:00Z",
    "method": "Rule-generated S2 compositional target with frozen ladder prompts.",
    "parameters": {
      "checksum": "L-904",
      "family": "letter-lattice",
      "values": [
        "Aster:violet:ember:echoes:61",
        "Beryl:silver:fable:folds:70",
        "Cato:crimson:glyph:glows:79",
        "Dessa:olive:harbor:halts:88"
      ]
    },
    "seed": 0
  },
  "stratum": "S2",
  "target": {
    "label": "S2 compositional seed 020",
    "text": "S2-020 letter lattice\nA. Aster echoes the violet ember at 61.\nB. Beryl folds the silver fable at 70.\nC. Cato glows the crimson glyph at 79.\nD. Dessa halts the olive harbor at 88.\nchecksum: L-904"
  }
}
