{
  "canaryGuid": "0f72d6e8-6d5a-4bb1-b8e0-cad1e31a3e6f",
  "frozenLadder": [
    {
      "expectedLeakage": "leaky_anchor",
      "id": "s2-017-r0-p0",
      "label": "Explicit Reconstruction",
      "paraphrase": 0,
      "prompt": "Reproduce this text exactly:\n\nS2-017 letter lattice\nA. Aster bends the blue binary at 40.\nB. Beryl clicks the copper cipher at 49.\nC. Cato drifts the jade delta at 58.\nD. Dessa echoes the violet ember at 67.\nchecksum: L-742",
      "rung": 0
    },
    {
      "expectedLeakage": "leaky_anchor",
      "id": "s2-017-r0-p1",
      "label": "Explicit Reconstruction",
      "paraphrase": 1,
      "prompt": "Copy the target verbatim with no extra words:\n\nS2-017 letter lattice\nA. Aster bends the blue binary at 40.\nB. Beryl clicks the copper cipher at 49.\nC. Cato drifts the jade delta at 58.\nD. Dessa echoes the violet ember at 67.\nchecksum: L-742",
      "rung": 0
    },
    {
      "expectedLeakage": "non_leaking_candidate",
      "id": "s2-017-r1-p0",
      "label": "Descriptive Rule",
      "paraphrase": 0,
      "prompt": "Create S2-017 letter lattice. Four lettered lines A-D use names Aster, Beryl, Cato, Dessa. For each line write '<letter>. <name> <verb> the <color> <noun> at <number>.' Use values Aster:blue:binary:bends:40; Beryl:copper:cipher:clicks:49; Cato:jade:delta:drifts:58; Dessa:violet:ember:echoes:67. End with checksum L-742.",
      "rung": 1
    },
    {
      "expectedLeakage": "non_leaking_candidate",
      "id": "s2-017-r1-p1",
      "label": "Descriptive Rule",
      "paraphrase": 1,
      "prompt": "Render a letter lattice titled S2-017 letter lattice: A-D lines with the fixed name/color/noun/verb/number tuples Aster:blue:binary:bends:40; Beryl:copper:cipher:clicks:49; Cato:jade:delta:drifts:58; Dessa:violet:ember:echoes:67 and final checksum L-742.",
      "rung": 1
    },
    {
      "expectedLeakage": "non_leaking_candidate",
      "id": "s2-017-r2-p0",
      "label": "Concept Prompt",
      "paraphrase": 0,
      "prompt": "S2-017 letter lattice; A-D lattice; tuples Aster:blue:binary:bends:40 | Beryl:copper:cipher:clicks:49 | Cato:jade:delta:drifts:58 | Dessa:violet:ember:echoes:67; checksum L-742.",
      "rung": 2
    },
    {
      "expectedLeakage": "non_leaking_candidate",
      "id": "s2-017-r2-p1",
      "label": "Concept Prompt",
      "paraphrase": 1,
      "prompt": "Lattice S2-017: Aster/Beryl/Cato/Dessa tuple list Aster:blue:binary:bends:40 | Beryl:copper:cipher:clicks:49 | Cato:jade:delta:drifts:58 | Dessa:violet:ember:echoes:67; L-742.",
      "rung": 2
    },
    {
      "expectedLeakage": "non_leaking_candidate",
      "id": "s2-017-r3-p0",
      "label": "Minimal Cue",
      "paraphrase": 0,
      "prompt": "S2-017 lattice L-742",
      "rung": 3
    },
    {
      "expectedLeakage": "non_leaking_candidate",
      "id": "s2-017-r3-p1",
      "label": "Minimal Cue",
      "paraphrase": 1,
      "prompt": "lattice 017: Aster:blue:binary:bends:40 ... L-742",
      "rung": 3
    }
  ],
  "id": "s2-017",
  "language": "en",
  "license": "CC0-1.0",
  "metricClass": "normalized_edit_similarity",
  "protocolVersion": "0.2.0",
  "provenance": {
    "createdBy": "Codex deterministic generator",
    "generatedAt": "2026-06-03T00:00:00Z",
    "method": "Rule-generated S2 compositional target with frozen ladder prompts.",
    "parameters": {
      "checksum": "L-742",
      "family": "letter-lattice",
      "values": [
        "Aster:blue:binary:bends:40",
        "Beryl:copper:cipher:clicks:49",
        "Cato:jade:delta:drifts:58",
        "Dessa:violet:ember:echoes:67"
      ]
    },
    "seed": 0
  },
  "stratum": "S2",
  "target": {
    "label": "S2 compositional seed 017",
    "text": "S2-017 letter lattice\nA. Aster bends the blue binary at 40.\nB. Beryl clicks the copper cipher at 49.\nC. Cato drifts the jade delta at 58.\nD. Dessa echoes the violet ember at 67.\nchecksum: L-742"
  }
}
