{
  "canaryGuid": "0f72d6e8-6d5a-4bb1-b8e0-cad1e31a3e6f",
  "frozenLadder": [
    {
      "expectedLeakage": "leaky_anchor",
      "id": "s2-008-r0-p0",
      "label": "Explicit Reconstruction",
      "paraphrase": 0,
      "prompt": "Reproduce this text exactly:\n\nS2-008 letter lattice\nA. Aster arcs the amber atom at 66.\nB. Beryl bends the blue binary at 75.\nC. Cato clicks the copper cipher at 84.\nD. Dessa drifts the jade delta at 93.\nchecksum: L-344",
      "rung": 0
    },
    {
      "expectedLeakage": "leaky_anchor",
      "id": "s2-008-r0-p1",
      "label": "Explicit Reconstruction",
      "paraphrase": 1,
      "prompt": "Copy the target verbatim with no extra words:\n\nS2-008 letter lattice\nA. Aster arcs the amber atom at 66.\nB. Beryl bends the blue binary at 75.\nC. Cato clicks the copper cipher at 84.\nD. Dessa drifts the jade delta at 93.\nchecksum: L-344",
      "rung": 0
    },
    {
      "expectedLeakage": "non_leaking_candidate",
      "id": "s2-008-r1-p0",
      "label": "Descriptive Rule",
      "paraphrase": 0,
      "prompt": "Create S2-008 letter lattice. Four lettered lines A-D use names Aster, Beryl, Cato, Dessa. For each line write '<letter>. <name> <verb> the <color> <noun> at <number>.' Use values Aster:amber:atom:arcs:66; Beryl:blue:binary:bends:75; Cato:copper:cipher:clicks:84; Dessa:jade:delta:drifts:93. End with checksum L-344.",
      "rung": 1
    },
    {
      "expectedLeakage": "non_leaking_candidate",
      "id": "s2-008-r1-p1",
      "label": "Descriptive Rule",
      "paraphrase": 1,
      "prompt": "Render a letter lattice titled S2-008 letter lattice: A-D lines with the fixed name/color/noun/verb/number tuples Aster:amber:atom:arcs:66; Beryl:blue:binary:bends:75; Cato:copper:cipher:clicks:84; Dessa:jade:delta:drifts:93 and final checksum L-344.",
      "rung": 1
    },
    {
      "expectedLeakage": "non_leaking_candidate",
      "id": "s2-008-r2-p0",
      "label": "Concept Prompt",
      "paraphrase": 0,
      "prompt": "S2-008 letter lattice; A-D lattice; tuples Aster:amber:atom:arcs:66 | Beryl:blue:binary:bends:75 | Cato:copper:cipher:clicks:84 | Dessa:jade:delta:drifts:93; checksum L-344.",
      "rung": 2
    },
    {
      "expectedLeakage": "non_leaking_candidate",
      "id": "s2-008-r2-p1",
      "label": "Concept Prompt",
      "paraphrase": 1,
      "prompt": "Lattice S2-008: Aster/Beryl/Cato/Dessa tuple list Aster:amber:atom:arcs:66 | Beryl:blue:binary:bends:75 | Cato:copper:cipher:clicks:84 | Dessa:jade:delta:drifts:93; L-344.",
      "rung": 2
    },
    {
      "expectedLeakage": "non_leaking_candidate",
      "id": "s2-008-r3-p0",
      "label": "Minimal Cue",
      "paraphrase": 0,
      "prompt": "S2-008 lattice L-344",
      "rung": 3
    },
    {
      "expectedLeakage": "non_leaking_candidate",
      "id": "s2-008-r3-p1",
      "label": "Minimal Cue",
      "paraphrase": 1,
      "prompt": "lattice 008: Aster:amber:atom:arcs:66 ... L-344",
      "rung": 3
    }
  ],
  "id": "s2-008",
  "language": "en",
  "license": "CC0-1.0",
  "metricClass": "normalized_edit_similarity",
  "protocolVersion": "0.2.0",
  "provenance": {
    "createdBy": "Codex deterministic generator",
    "generatedAt": "2026-06-03T00:00:00Z",
    "method": "Rule-generated S2 compositional target with frozen ladder prompts.",
    "parameters": {
      "checksum": "L-344",
      "family": "letter-lattice",
      "values": [
        "Aster:amber:atom:arcs:66",
        "Beryl:blue:binary:bends:75",
        "Cato:copper:cipher:clicks:84",
        "Dessa:jade:delta:drifts:93"
      ]
    },
    "seed": 0
  },
  "stratum": "S2",
  "target": {
    "label": "S2 compositional seed 008",
    "text": "S2-008 letter lattice\nA. Aster arcs the amber atom at 66.\nB. Beryl bends the blue binary at 75.\nC. Cato clicks the copper cipher at 84.\nD. Dessa drifts the jade delta at 93.\nchecksum: L-344"
  }
}
