{
  "canaryGuid": "0f72d6e8-6d5a-4bb1-b8e0-cad1e31a3e6f",
  "frozenLadder": [
    {
      "expectedLeakage": "leaky_anchor",
      "id": "s2-024-r0-p0",
      "label": "Explicit Reconstruction",
      "paraphrase": 0,
      "prompt": "Reproduce this text exactly:\n\nS2-024 route receipt\nleg 1: go north for 4; mark=R3\nleg 2: go east for 5; mark=K7\nleg 3: go south for 6; mark=M2\nleg 4: go west for 7; mark=Q5\ntotal: 22; parity: even; code: R-538",
      "rung": 0
    },
    {
      "expectedLeakage": "leaky_anchor",
      "id": "s2-024-r0-p1",
      "label": "Explicit Reconstruction",
      "paraphrase": 1,
      "prompt": "Copy the target verbatim with no extra words:\n\nS2-024 route receipt\nleg 1: go north for 4; mark=R3\nleg 2: go east for 5; mark=K7\nleg 3: go south for 6; mark=M2\nleg 4: go west for 7; mark=Q5\ntotal: 22; parity: even; code: R-538",
      "rung": 0
    },
    {
      "expectedLeakage": "non_leaking_candidate",
      "id": "s2-024-r1-p0",
      "label": "Descriptive Rule",
      "paraphrase": 0,
      "prompt": "Create S2-024 route receipt. Print four legs as 'leg i: go direction for distance; mark=mark'. Use leg triples north:4:R3; east:5:K7; south:6:M2; west:7:Q5. Then print total 22, parity even, code R-538.",
      "rung": 1
    },
    {
      "expectedLeakage": "non_leaking_candidate",
      "id": "s2-024-r1-p1",
      "label": "Descriptive Rule",
      "paraphrase": 1,
      "prompt": "Render a route receipt named S2-024 route receipt; four legs from triples north:4:R3; east:5:K7; south:6:M2; west:7:Q5; finish with total 22, parity even, and code R-538.",
      "rung": 1
    },
    {
      "expectedLeakage": "non_leaking_candidate",
      "id": "s2-024-r2-p0",
      "label": "Concept Prompt",
      "paraphrase": 0,
      "prompt": "S2-024 route receipt; route schema; legs north:4:R3 | east:5:K7 | south:6:M2 | west:7:Q5; total 22; even; R-538.",
      "rung": 2
    },
    {
      "expectedLeakage": "non_leaking_candidate",
      "id": "s2-024-r2-p1",
      "label": "Concept Prompt",
      "paraphrase": 1,
      "prompt": "Route S2-024: north:4:R3 | east:5:K7 | south:6:M2 | west:7:Q5 -> 22/even/R-538.",
      "rung": 2
    },
    {
      "expectedLeakage": "non_leaking_candidate",
      "id": "s2-024-r3-p0",
      "label": "Minimal Cue",
      "paraphrase": 0,
      "prompt": "S2-024 route R-538",
      "rung": 3
    },
    {
      "expectedLeakage": "non_leaking_candidate",
      "id": "s2-024-r3-p1",
      "label": "Minimal Cue",
      "paraphrase": 1,
      "prompt": "route 024: north:4:R3 ... R-538",
      "rung": 3
    }
  ],
  "id": "s2-024",
  "language": "en",
  "license": "CC0-1.0",
  "metricClass": "normalized_edit_similarity",
  "protocolVersion": "0.2.0",
  "provenance": {
    "createdBy": "Codex deterministic generator",
    "generatedAt": "2026-06-03T00:00:00Z",
    "method": "Rule-generated S2 compositional target with frozen ladder prompts.",
    "parameters": {
      "code": "R-538",
      "family": "route",
      "legs": [
        "north:4:R3",
        "east:5:K7",
        "south:6:M2",
        "west:7:Q5"
      ],
      "parity": "even",
      "total": 22
    },
    "seed": 0
  },
  "stratum": "S2",
  "target": {
    "label": "S2 compositional seed 024",
    "text": "S2-024 route receipt\nleg 1: go north for 4; mark=R3\nleg 2: go east for 5; mark=K7\nleg 3: go south for 6; mark=M2\nleg 4: go west for 7; mark=Q5\ntotal: 22; parity: even; code: R-538"
  }
}
