{
  "canaryGuid": "0f72d6e8-6d5a-4bb1-b8e0-cad1e31a3e6f",
  "frozenLadder": [
    {
      "expectedLeakage": "leaky_anchor",
      "id": "s2-014-r0-p0",
      "label": "Explicit Reconstruction",
      "paraphrase": 0,
      "prompt": "Reproduce this text exactly:\n\nS2-014 letter lattice\nA. Aster glows the crimson glyph at 19.\nB. Beryl halts the olive harbor at 28.\nC. Cato arcs the amber atom at 37.\nD. Dessa bends the blue binary at 46.\nchecksum: L-668",
      "rung": 0
    },
    {
      "expectedLeakage": "leaky_anchor",
      "id": "s2-014-r0-p1",
      "label": "Explicit Reconstruction",
      "paraphrase": 1,
      "prompt": "Copy the target verbatim with no extra words:\n\nS2-014 letter lattice\nA. Aster glows the crimson glyph at 19.\nB. Beryl halts the olive harbor at 28.\nC. Cato arcs the amber atom at 37.\nD. Dessa bends the blue binary at 46.\nchecksum: L-668",
      "rung": 0
    },
    {
      "expectedLeakage": "non_leaking_candidate",
      "id": "s2-014-r1-p0",
      "label": "Descriptive Rule",
      "paraphrase": 0,
      "prompt": "Create S2-014 letter lattice. Four lettered lines A-D use names Aster, Beryl, Cato, Dessa. For each line write '<letter>. <name> <verb> the <color> <noun> at <number>.' Use values Aster:crimson:glyph:glows:19; Beryl:olive:harbor:halts:28; Cato:amber:atom:arcs:37; Dessa:blue:binary:bends:46. End with checksum L-668.",
      "rung": 1
    },
    {
      "expectedLeakage": "non_leaking_candidate",
      "id": "s2-014-r1-p1",
      "label": "Descriptive Rule",
      "paraphrase": 1,
      "prompt": "Render a letter lattice titled S2-014 letter lattice: A-D lines with the fixed name/color/noun/verb/number tuples Aster:crimson:glyph:glows:19; Beryl:olive:harbor:halts:28; Cato:amber:atom:arcs:37; Dessa:blue:binary:bends:46 and final checksum L-668.",
      "rung": 1
    },
    {
      "expectedLeakage": "non_leaking_candidate",
      "id": "s2-014-r2-p0",
      "label": "Concept Prompt",
      "paraphrase": 0,
      "prompt": "S2-014 letter lattice; A-D lattice; tuples Aster:crimson:glyph:glows:19 | Beryl:olive:harbor:halts:28 | Cato:amber:atom:arcs:37 | Dessa:blue:binary:bends:46; checksum L-668.",
      "rung": 2
    },
    {
      "expectedLeakage": "non_leaking_candidate",
      "id": "s2-014-r2-p1",
      "label": "Concept Prompt",
      "paraphrase": 1,
      "prompt": "Lattice S2-014: Aster/Beryl/Cato/Dessa tuple list Aster:crimson:glyph:glows:19 | Beryl:olive:harbor:halts:28 | Cato:amber:atom:arcs:37 | Dessa:blue:binary:bends:46; L-668.",
      "rung": 2
    },
    {
      "expectedLeakage": "non_leaking_candidate",
      "id": "s2-014-r3-p0",
      "label": "Minimal Cue",
      "paraphrase": 0,
      "prompt": "S2-014 lattice L-668",
      "rung": 3
    },
    {
      "expectedLeakage": "non_leaking_candidate",
      "id": "s2-014-r3-p1",
      "label": "Minimal Cue",
      "paraphrase": 1,
      "prompt": "lattice 014: Aster:crimson:glyph:glows:19 ... L-668",
      "rung": 3
    }
  ],
  "id": "s2-014",
  "language": "en",
  "license": "CC0-1.0",
  "metricClass": "normalized_edit_similarity",
  "protocolVersion": "0.2.0",
  "provenance": {
    "createdBy": "Codex deterministic generator",
    "generatedAt": "2026-06-03T00:00:00Z",
    "method": "Rule-generated S2 compositional target with frozen ladder prompts.",
    "parameters": {
      "checksum": "L-668",
      "family": "letter-lattice",
      "values": [
        "Aster:crimson:glyph:glows:19",
        "Beryl:olive:harbor:halts:28",
        "Cato:amber:atom:arcs:37",
        "Dessa:blue:binary:bends:46"
      ]
    },
    "seed": 0
  },
  "stratum": "S2",
  "target": {
    "label": "S2 compositional seed 014",
    "text": "S2-014 letter lattice\nA. Aster glows the crimson glyph at 19.\nB. Beryl halts the olive harbor at 28.\nC. Cato arcs the amber atom at 37.\nD. Dessa bends the blue binary at 46.\nchecksum: L-668"
  }
}
